Name,Slug,Collection ID,Locale ID,Item ID,Created On,Updated On,Published On,Cover Image,Location,Date,Reference: Image Set
AMALIE GASSMAN x Dior,amalie-gassman-dior-90932,67e0f5d52a78aeb2279ecc81,67da44024929a3dd38d282e1,67e6273e034b2ff1c8910c82,Fri Mar 28 2025 04:36:14 GMT+0000 (Coordinated Universal Time),Fri Mar 28 2025 04:36:14 GMT+0000 (Coordinated Universal Time),Fri Mar 28 2025 04:36:14 GMT+0000 (Coordinated Universal Time),https://cdn.prod.website-files.com/67da44024929a3dd38d282e7/67e38b305799ab1207a2745b_asset-11.png,,,amalie-gassman-x-dior-1; amalie-gassman-x-dior-2; amalie-gassman-x-dior-3; amalie-gassman-x-dior-4
AMALIE GASSMAN x Ferragamo,amalie-gassman-ferragamo-2-08ec7,67e0f5d52a78aeb2279ecc81,67da44024929a3dd38d282e1,67e62772e1cdc8aa80fed3e0,Fri Mar 28 2025 04:37:06 GMT+0000 (Coordinated Universal Time),Fri Mar 28 2025 04:37:06 GMT+0000 (Coordinated Universal Time),Fri Mar 28 2025 04:37:06 GMT+0000 (Coordinated Universal Time),https://cdn.prod.website-files.com/67da44024929a3dd38d282e7/67e38b1854e80a74ccc956e6_asset-18.png,,,amalie-gassman-x-ferragamo-1-3db99; amalie-gassman-x-ferragamo-2-f1ae0; amalie-gassman-x-ferragamo-3-17777; amalie-gassman-x-ferragamo-4; amalie-gassman-x-ferragamo-5-e5627; amalie-gassman-x-ferragamo-6-2daa2; amalie-gassman-x-ferragamo-1; amalie-gassman-x-ferragamo-2; amalie-gassman-x-ferragamo-3; amalie-gassman-x-ferragamo-4-ae898; amalie-gassman-x-ferragamo-5; amalie-gassman-x-ferragamo-6
AMALIE GASSMAN x Miu Miu,amalie-gassman-miu-miu-fcd54,67e0f5d52a78aeb2279ecc81,67da44024929a3dd38d282e1,67e62756454a75e2b7e0cbde,Fri Mar 28 2025 04:36:38 GMT+0000 (Coordinated Universal Time),Fri Mar 28 2025 04:36:38 GMT+0000 (Coordinated Universal Time),Fri Mar 28 2025 04:36:38 GMT+0000 (Coordinated Universal Time),https://cdn.prod.website-files.com/67da44024929a3dd38d282e7/67e38b21be1a9c89f1e39cc1_asset-14.png,,,amalie-gassman-x-miu-miu-1; amalie-gassman-x-miu-miu-2; amalie-gassman-x-miu-miu-3; amalie-gassman-x-miu-miu-4
AMALIE GASSMAN x Prada,amalie-gassman-prada-95a57,67e0f5d52a78aeb2279ecc81,67da44024929a3dd38d282e1,67e62743c09fb7aa88709c47,Fri Mar 28 2025 04:36:19 GMT+0000 (Coordinated Universal Time),Fri Mar 28 2025 04:36:19 GMT+0000 (Coordinated Universal Time),Fri Mar 28 2025 04:36:19 GMT+0000 (Coordinated Universal Time),https://cdn.prod.website-files.com/67da44024929a3dd38d282e7/67e38b9428e78f764b65a48b_asset-16.png,,,amalie-gassman-x-prada-1; amalie-gassman-x-prada-2; amalie-gassman-x-prada-3; amalie-gassman-x-prada-4; amalie-gassman-x-prada-5
AMALIE GASSMANN x Ann Demeulemeester,amalie-gassmann-ann-demeulemeester-95c90,67e0f5d52a78aeb2279ecc81,67da44024929a3dd38d282e1,67e62737346db6f95b2e6261,Fri Mar 28 2025 04:36:07 GMT+0000 (Coordinated Universal Time),Fri Mar 28 2025 04:36:07 GMT+0000 (Coordinated Universal Time),Fri Mar 28 2025 04:36:07 GMT+0000 (Coordinated Universal Time),https://cdn.prod.website-files.com/67da44024929a3dd38d282e7/67e38b2c7506da73e8ce9a59_asset-10.png,,,amalie-gassmann-x-ann-demeulemeester-1; amalie-gassmann-x-ann-demeulemeester-2; amalie-gassmann-x-ann-demeulemeester-3; amalie-gassmann-x-ann-demeulemeester-4; amalie-gassmann-x-ann-demeulemeester-5; amalie-gassmann-x-ann-demeulemeester-6
ANAA SABER,anaa-saber-nyc-2024-e0d35,67e0f5d52a78aeb2279ecc81,67da44024929a3dd38d282e1,67e627b553c96ba5389d08d7,Fri Mar 28 2025 04:38:13 GMT+0000 (Coordinated Universal Time),Fri Mar 28 2025 04:38:13 GMT+0000 (Coordinated Universal Time),Fri Mar 28 2025 04:38:13 GMT+0000 (Coordinated Universal Time),https://cdn.prod.website-files.com/67da44024929a3dd38d282e7/67e38b1d6dcabb8ddba9aa84_asset-22.png,Nyc,2024,anaa-saber-1; anaa-saber-2; anaa-saber-3; anaa-saber-4
ANAA SABER x Balenciaga (2x),anaa-saber-balenciaga-2x-6ee4b,67e0f5d52a78aeb2279ecc81,67da44024929a3dd38d282e1,67e627ad6fa325eaf6db804b,Fri Mar 28 2025 04:38:05 GMT+0000 (Coordinated Universal Time),Fri Mar 28 2025 04:38:05 GMT+0000 (Coordinated Universal Time),Fri Mar 28 2025 04:38:05 GMT+0000 (Coordinated Universal Time),https://cdn.prod.website-files.com/67da44024929a3dd38d282e7/67e38b7c343ac8a464a0869a_asset-20.png,,,anaa-saber-x-balenciaga-2x-1; anaa-saber-x-balenciaga-2x-2; anaa-saber-x-balenciaga-2x-3; anaa-saber-x-balenciaga-2x-4; anaa-saber-x-balenciaga-2x-5; anaa-saber-x-balenciaga-2x-6
ANAA SABER x Sacai,anaa-saber-sacai-10bda,67e0f5d52a78aeb2279ecc81,67da44024929a3dd38d282e1,67e627cfd87c95b37073a8aa,Fri Mar 28 2025 04:38:39 GMT+0000 (Coordinated Universal Time),Fri Mar 28 2025 04:38:39 GMT+0000 (Coordinated Universal Time),Fri Mar 28 2025 04:38:39 GMT+0000 (Coordinated Universal Time),https://cdn.prod.website-files.com/67da44024929a3dd38d282e7/67e38b7dd4b268fd325fef89_asset-21.png,,,anaa-saber-x-sacai-1; anaa-saber-x-sacai-2; anaa-saber-x-sacai-3; anaa-saber-x-sacai-4; anaa-saber-x-sacai-5; anaa-saber-x-sacai-6; anaa-saber-x-sacai-7
ARI FOURNIER x Madewell,ari-fournier-madewell-54ca3,67e0f5d52a78aeb2279ecc81,67da44024929a3dd38d282e1,67e627a989642c5fabf5b49a,Fri Mar 28 2025 04:38:01 GMT+0000 (Coordinated Universal Time),Fri Mar 28 2025 04:38:01 GMT+0000 (Coordinated Universal Time),Fri Mar 28 2025 04:38:01 GMT+0000 (Coordinated Universal Time),https://cdn.prod.website-files.com/67da44024929a3dd38d282e7/67e38b4e57384b56daf1940b_asset-27.png,,,ari-fournier-x-madewell-1; ari-fournier-x-madewell-2; ari-fournier-x-madewell-3
ARI FOURNIER x Rabanne,ari-fournier-rabanne-704b2,67e0f5d52a78aeb2279ecc81,67da44024929a3dd38d282e1,67e627a7582f8307d75cf2ca,Fri Mar 28 2025 04:37:59 GMT+0000 (Coordinated Universal Time),Fri Mar 28 2025 04:37:59 GMT+0000 (Coordinated Universal Time),Fri Mar 28 2025 04:37:59 GMT+0000 (Coordinated Universal Time),https://cdn.prod.website-files.com/67da44024929a3dd38d282e7/67e38b33913e11e70cfac39b_asset-23.jpeg,,,ari-fournier-x-rabanne-1; ari-fournier-x-rabanne-2; ari-fournier-x-rabanne-3; ari-fournier-x-rabanne-4
BRIANNA ANDERSON,brianna-anderson-nyc-summer-2024-8937c,67e0f5d52a78aeb2279ecc81,67da44024929a3dd38d282e1,67e627633de206247a61ab02,Fri Mar 28 2025 04:36:51 GMT+0000 (Coordinated Universal Time),Fri Mar 28 2025 04:36:51 GMT+0000 (Coordinated Universal Time),Fri Mar 28 2025 04:36:51 GMT+0000 (Coordinated Universal Time),https://cdn.prod.website-files.com/67da44024929a3dd38d282e7/67e38b5f9c6f231ea0b71d80_asset-9.png,Nyc,Summer 2024,brianna-anderson-1; brianna-anderson-2; brianna-anderson-3; brianna-anderson-4; brianna-anderson-5; brianna-anderson-6; brianna-anderson-7
CAMELIA FARHOODI x Ottilinger,camelia-farhoodi-ottilinger-fa666,67e0f5d52a78aeb2279ecc81,67da44024929a3dd38d282e1,67e6277f89642c5fabf580c2,Fri Mar 28 2025 04:37:19 GMT+0000 (Coordinated Universal Time),Fri Mar 28 2025 04:37:19 GMT+0000 (Coordinated Universal Time),Fri Mar 28 2025 04:37:19 GMT+0000 (Coordinated Universal Time),https://cdn.prod.website-files.com/67da44024929a3dd38d282e7/67e38b7a74815414f015dc9a_asset-28.jpeg,,,camelia-farhoodi-x-ottilinger-1; camelia-farhoodi-x-ottilinger-2; camelia-farhoodi-x-ottilinger-3; camelia-farhoodi-x-ottilinger-4
CHASE HUDSON x Rabanne,chase-hudson-rabanne-bd917,67e0f5d52a78aeb2279ecc81,67da44024929a3dd38d282e1,67e6272efa89b60c548f5c3a,Fri Mar 28 2025 04:35:58 GMT+0000 (Coordinated Universal Time),Fri Mar 28 2025 04:35:58 GMT+0000 (Coordinated Universal Time),Fri Mar 28 2025 04:35:58 GMT+0000 (Coordinated Universal Time),https://cdn.prod.website-files.com/67da44024929a3dd38d282e7/67e38b2d3db0c2da09044ce1_asset-29.jpeg,,,chase-hudson-x-rabanne-1; chase-hudson-x-rabanne-2; chase-hudson-x-rabanne-3
DEMI SINGLETON x Miu Miu,demi-singleton-miu-miu-c570b,67e0f5d52a78aeb2279ecc81,67da44024929a3dd38d282e1,67e62751ba437c956a2b3f41,Fri Mar 28 2025 04:36:33 GMT+0000 (Coordinated Universal Time),Fri Mar 28 2025 04:36:33 GMT+0000 (Coordinated Universal Time),Fri Mar 28 2025 04:36:33 GMT+0000 (Coordinated Universal Time),https://cdn.prod.website-files.com/67da44024929a3dd38d282e7/67e38b636dcabb8ddbaa0d67_asset-31.png,,,demi-singleton-x-miu-miu-1; demi-singleton-x-miu-miu-2; demi-singleton-x-miu-miu-3
DREW STAKEY x Loewe For Vogue,drew-stakey-loewe-vogue-c5d93,67e0f5d52a78aeb2279ecc81,67da44024929a3dd38d282e1,67e6279d89642c5fabf5a3b5,Fri Mar 28 2025 04:37:49 GMT+0000 (Coordinated Universal Time),Fri Mar 28 2025 04:37:49 GMT+0000 (Coordinated Universal Time),Fri Mar 28 2025 04:37:49 GMT+0000 (Coordinated Universal Time),https://cdn.prod.website-files.com/67da44024929a3dd38d282e7/67e38b38b054d5916564f29c_asset-33.jpeg,,,drew-stakey-x-loewe-for-vogue-1; drew-stakey-x-loewe-for-vogue-2; drew-stakey-x-loewe-for-vogue-3; drew-stakey-x-loewe-for-vogue-4; drew-stakey-x-loewe-for-vogue-5; drew-stakey-x-loewe-for-vogue-6; drew-stakey-x-loewe-for-vogue-7
EMILY RATAJKOWSKI x Bode,emily-ratajkowski-bode-8d3a5,67e0f5d52a78aeb2279ecc81,67da44024929a3dd38d282e1,67e627a2b50467c3749a32c6,Fri Mar 28 2025 04:37:54 GMT+0000 (Coordinated Universal Time),Fri Mar 28 2025 04:37:54 GMT+0000 (Coordinated Universal Time),Fri Mar 28 2025 04:37:54 GMT+0000 (Coordinated Universal Time),https://cdn.prod.website-files.com/67da44024929a3dd38d282e7/67e38b3fa9f43d191c9d9e15_asset-39.png,,,emily-ratajkowski-x-bode-1; emily-ratajkowski-x-bode-2; emily-ratajkowski-x-bode-3
EMILY RATAJKOWSKI x Courrages,lucky-blue-smith-prada-paris,67e0f5d52a78aeb2279ecc81,67da44024929a3dd38d282e1,67e62765fa89b60c548fa4ae,Fri Mar 28 2025 04:36:53 GMT+0000 (Coordinated Universal Time),Fri Mar 28 2025 04:36:53 GMT+0000 (Coordinated Universal Time),Fri Mar 28 2025 04:36:53 GMT+0000 (Coordinated Universal Time),https://cdn.prod.website-files.com/67da44024929a3dd38d282e7/67e38b51b054d59165651105_asset-6.png,,,emily-ratajkowski-x-courrages-1; emily-ratajkowski-x-courrages-2; emily-ratajkowski-x-courrages-3; emily-ratajkowski-x-courrages-4; emily-ratajkowski-x-courrages-5; emily-ratajkowski-x-courrages-6
EMILY RATAJKOWSKI x Ferragamo,emily-ratajkowski-ferragamo-88a4e,67e0f5d52a78aeb2279ecc81,67da44024929a3dd38d282e1,67e627a0213a7dfb564b83b6,Fri Mar 28 2025 04:37:52 GMT+0000 (Coordinated Universal Time),Fri Mar 28 2025 04:37:52 GMT+0000 (Coordinated Universal Time),Fri Mar 28 2025 04:37:52 GMT+0000 (Coordinated Universal Time),https://cdn.prod.website-files.com/67da44024929a3dd38d282e7/67e38b4c654ded82891a8d7d_asset-40.png,,,emily-ratajkowski-x-ferragamo-1; emily-ratajkowski-x-ferragamo-2; emily-ratajkowski-x-ferragamo-3
EMILY RATAJKOWSKI x Jacquemus,lucy-rae-mcfadin-coach,67e0f5d52a78aeb2279ecc81,67da44024929a3dd38d282e1,67e627759e812365dd854297,Fri Mar 28 2025 04:37:09 GMT+0000 (Coordinated Universal Time),Fri Mar 28 2025 04:37:09 GMT+0000 (Coordinated Universal Time),Fri Mar 28 2025 04:37:09 GMT+0000 (Coordinated Universal Time),https://cdn.prod.website-files.com/67da44024929a3dd38d282e7/67e38b2a63d5bc34f575ca82_asset-1.png,,,emily-ratajkowski-x-jacquemus-1; emily-ratajkowski-x-jacquemus-2; emily-ratajkowski-x-jacquemus-3
EMILY RATAJKOWSKI x Pre-Vanity Fair,emily-ratajkowski-pre-vanity-fair-9901f,67e0f5d52a78aeb2279ecc81,67da44024929a3dd38d282e1,67e6273031ec00fe71fd4647,Fri Mar 28 2025 04:36:00 GMT+0000 (Coordinated Universal Time),Fri Mar 28 2025 04:36:00 GMT+0000 (Coordinated Universal Time),Fri Mar 28 2025 04:36:00 GMT+0000 (Coordinated Universal Time),https://cdn.prod.website-files.com/67da44024929a3dd38d282e7/67e38b568e9a639c331129ef_asset-36.png,,,emily-ratajkowski-x-pre-vanity-fair-1; emily-ratajkowski-x-pre-vanity-fair-2; emily-ratajkowski-x-pre-vanity-fair-3
EVA GOTOWSKI for Merde Magazine - Cover,eva-gotowski-for-merde-magazine-cover-3655b,67e0f5d52a78aeb2279ecc81,67da44024929a3dd38d282e1,67e627d1944d9536305dce95,Fri Mar 28 2025 04:38:41 GMT+0000 (Coordinated Universal Time),Fri Mar 28 2025 04:38:41 GMT+0000 (Coordinated Universal Time),Fri Mar 28 2025 04:38:41 GMT+0000 (Coordinated Universal Time),https://cdn.prod.website-files.com/67da44024929a3dd38d282e7/67e38b51b054d59165651105_asset-6.png,,,eva-gotowski-for-merde-magazine-cover-1; eva-gotowski-for-merde-magazine-cover-2; eva-gotowski-for-merde-magazine-cover-3; eva-gotowski-for-merde-magazine-cover-4; eva-gotowski-for-merde-magazine-cover-5; eva-gotowski-for-merde-magazine-cover-6
GRAZIA MAGAZINE - Feature,grazia-magazine-feature-7c4e0,67e0f5d52a78aeb2279ecc81,67da44024929a3dd38d282e1,67e62769ba437c956a2b63d9,Fri Mar 28 2025 04:36:57 GMT+0000 (Coordinated Universal Time),Fri Mar 28 2025 04:36:57 GMT+0000 (Coordinated Universal Time),Fri Mar 28 2025 04:36:57 GMT+0000 (Coordinated Universal Time),https://cdn.prod.website-files.com/67da44024929a3dd38d282e7/67e38b2a63d5bc34f575ca82_asset-1.png,,,grazia-magazine-feature-1; grazia-magazine-feature-2; grazia-magazine-feature-3; grazia-magazine-feature-4; grazia-magazine-feature-5
HOLLY LIM x En Route,ivy-getty-tory-burch-town-country,67e0f5d52a78aeb2279ecc81,67da44024929a3dd38d282e1,67e627c0825bb150ff83e5f2,Fri Mar 28 2025 04:38:24 GMT+0000 (Coordinated Universal Time),Fri Mar 28 2025 04:38:24 GMT+0000 (Coordinated Universal Time),Fri Mar 28 2025 04:38:24 GMT+0000 (Coordinated Universal Time),https://cdn.prod.website-files.com/67da44024929a3dd38d282e7/67e38b305799ab1207a2745b_asset-11.png,,,holly-lim-x-en-route-1; holly-lim-x-en-route-2; holly-lim-x-en-route-3; holly-lim-x-en-route-4
HOLLY LIM x Mirror Palais,ivy-getty-mugler,67e0f5d52a78aeb2279ecc81,67da44024929a3dd38d282e1,67e627c7a24891a50fab1c02,Fri Mar 28 2025 04:38:31 GMT+0000 (Coordinated Universal Time),Fri Mar 28 2025 04:38:31 GMT+0000 (Coordinated Universal Time),Fri Mar 28 2025 04:38:31 GMT+0000 (Coordinated Universal Time),https://cdn.prod.website-files.com/67da44024929a3dd38d282e7/67e38b2c7506da73e8ce9a59_asset-10.png,,,holly-lim-x-mirror-palais-1; holly-lim-x-mirror-palais-2; holly-lim-x-mirror-palais-3; holly-lim-x-mirror-palais-4; holly-lim-x-mirror-palais-5; holly-lim-x-mirror-palais-6; holly-lim-x-mirror-palais-7
IVY GETTY x Mugler,ivy-getty-vogue,67e0f5d52a78aeb2279ecc81,67da44024929a3dd38d282e1,67e6274ba24891a50faa862f,Fri Mar 28 2025 04:36:27 GMT+0000 (Coordinated Universal Time),Fri Mar 28 2025 04:36:27 GMT+0000 (Coordinated Universal Time),Fri Mar 28 2025 04:36:27 GMT+0000 (Coordinated Universal Time),https://cdn.prod.website-files.com/67da44024929a3dd38d282e7/67e38b21be1a9c89f1e39cc1_asset-14.png,,,ivy-getty-x-mugler-1; ivy-getty-x-mugler-2; ivy-getty-x-mugler-3; ivy-getty-x-mugler-4
IVY GETTY x Tory Burch (town + Country),ivy-nina-ricci,67e0f5d52a78aeb2279ecc81,67da44024929a3dd38d282e1,67e6276fc8a8ee498ffa8099,Fri Mar 28 2025 04:37:03 GMT+0000 (Coordinated Universal Time),Fri Mar 28 2025 04:37:03 GMT+0000 (Coordinated Universal Time),Fri Mar 28 2025 04:37:03 GMT+0000 (Coordinated Universal Time),https://cdn.prod.website-files.com/67da44024929a3dd38d282e7/67e38b9428e78f764b65a48b_asset-16.png,,,ivy-getty-x-tory-burch-town-country-1; ivy-getty-x-tory-burch-town-country-2; ivy-getty-x-tory-burch-town-country-3; ivy-getty-x-tory-burch-town-country-4; ivy-getty-x-tory-burch-town-country-5; ivy-getty-x-tory-burch-town-country-6
IVY GETTY x Vogue,jeff-goldblum-loewe-vogue,67e0f5d52a78aeb2279ecc81,67da44024929a3dd38d282e1,67e6275bc09fb7aa8870c2ee,Fri Mar 28 2025 04:36:43 GMT+0000 (Coordinated Universal Time),Fri Mar 28 2025 04:36:43 GMT+0000 (Coordinated Universal Time),Fri Mar 28 2025 04:36:43 GMT+0000 (Coordinated Universal Time),https://cdn.prod.website-files.com/67da44024929a3dd38d282e7/67e38b272117ed858b9392ea_asset-17.png,,,ivy-getty-x-vogue-1; ivy-getty-x-vogue-2; ivy-getty-x-vogue-3; ivy-getty-x-vogue-4; ivy-getty-x-vogue-5; ivy-getty-x-vogue-6
IVY x Nina Ricci,jesse-jo-stark-highsnobiety,67e0f5d52a78aeb2279ecc81,67da44024929a3dd38d282e1,67e62798d450a6ba1d012322,Fri Mar 28 2025 04:37:44 GMT+0000 (Coordinated Universal Time),Fri Mar 28 2025 04:37:44 GMT+0000 (Coordinated Universal Time),Fri Mar 28 2025 04:37:44 GMT+0000 (Coordinated Universal Time),https://cdn.prod.website-files.com/67da44024929a3dd38d282e7/67e38b1854e80a74ccc956e6_asset-18.png,,,ivy-x-nina-ricci-1; ivy-x-nina-ricci-2; ivy-x-nina-ricci-3
JEFF GOLDBLUM x Loewe For Vogue,jessie-andrews-wonderland,67e0f5d52a78aeb2279ecc81,67da44024929a3dd38d282e1,67e6277d346477f4e6955bc7,Fri Mar 28 2025 04:37:17 GMT+0000 (Coordinated Universal Time),Fri Mar 28 2025 04:37:17 GMT+0000 (Coordinated Universal Time),Fri Mar 28 2025 04:37:17 GMT+0000 (Coordinated Universal Time),https://cdn.prod.website-files.com/67da44024929a3dd38d282e7/67e38b7c343ac8a464a0869a_asset-20.png,,,jeff-goldblum-x-loewe-for-vogue-1; jeff-goldblum-x-loewe-for-vogue-2; jeff-goldblum-x-loewe-for-vogue-3
JESSE JO STARK x Highsnobiety,jessie-andrews-prada,67e0f5d52a78aeb2279ecc81,67da44024929a3dd38d282e1,67e627d3e3494f4159a85f62,Fri Mar 28 2025 04:38:43 GMT+0000 (Coordinated Universal Time),Fri Mar 28 2025 04:38:43 GMT+0000 (Coordinated Universal Time),Fri Mar 28 2025 04:38:43 GMT+0000 (Coordinated Universal Time),https://cdn.prod.website-files.com/67da44024929a3dd38d282e7/67e38b7dd4b268fd325fef89_asset-21.png,,,jesse-jo-stark-x-highsnobiety-1; jesse-jo-stark-x-highsnobiety-2; jesse-jo-stark-x-highsnobiety-3
JESSIE ANDREWS,nara-smith-calvin-klein,67e0f5d52a78aeb2279ecc81,67da44024929a3dd38d282e1,67e62791034b2ff1c89184b8,Fri Mar 28 2025 04:37:37 GMT+0000 (Coordinated Universal Time),Fri Mar 28 2025 04:37:37 GMT+0000 (Coordinated Universal Time),Fri Mar 28 2025 04:37:37 GMT+0000 (Coordinated Universal Time),https://cdn.prod.website-files.com/67da44024929a3dd38d282e7/67e38b7a74815414f015dc9a_asset-28.jpeg,Nyc,2024,jessie-andrews-1; jessie-andrews-2; jessie-andrews-3; jessie-andrews-4; jessie-andrews-5; jessie-andrews-6
JESSIE ANDREWS x Dolce Gabbana,jonathan-bailey-loewe-pre-met-gala,67e0f5d52a78aeb2279ecc81,67da44024929a3dd38d282e1,67e6275231ec00fe71fd6b09,Fri Mar 28 2025 04:36:34 GMT+0000 (Coordinated Universal Time),Fri Mar 28 2025 04:36:34 GMT+0000 (Coordinated Universal Time),Fri Mar 28 2025 04:36:34 GMT+0000 (Coordinated Universal Time),https://cdn.prod.website-files.com/67da44024929a3dd38d282e7/67e38b4e57384b56daf1940b_asset-27.png,,,jessie-andrews-x-dolce-gabbana-1; jessie-andrews-x-dolce-gabbana-2; jessie-andrews-x-dolce-gabbana-3
JESSIE ANDREWS x Prada,jessie-andrews-nyc-2024,67e0f5d52a78aeb2279ecc81,67da44024929a3dd38d282e1,67e62739454a75e2b7e0a426,Fri Mar 28 2025 04:36:09 GMT+0000 (Coordinated Universal Time),Fri Mar 28 2025 04:36:09 GMT+0000 (Coordinated Universal Time),Fri Mar 28 2025 04:36:09 GMT+0000 (Coordinated Universal Time),https://cdn.prod.website-files.com/67da44024929a3dd38d282e7/67e38b33913e11e70cfac39b_asset-23.jpeg,,,jessie-andrews-x-prada-1; jessie-andrews-x-prada-2; jessie-andrews-x-prada-3; jessie-andrews-x-prada-4; jessie-andrews-x-prada-5; jessie-andrews-x-prada-6
JESSIE ANDREWS x Wonderland,jessie-andrews-dolce-gabbana,67e0f5d52a78aeb2279ecc81,67da44024929a3dd38d282e1,67e62742e1cdc8aa80fe9018,Fri Mar 28 2025 04:36:18 GMT+0000 (Coordinated Universal Time),Fri Mar 28 2025 04:36:18 GMT+0000 (Coordinated Universal Time),Fri Mar 28 2025 04:36:18 GMT+0000 (Coordinated Universal Time),https://cdn.prod.website-files.com/67da44024929a3dd38d282e7/67e38b1d6dcabb8ddba9aa84_asset-22.png,,,jessie-andrews-x-wonderland-1; jessie-andrews-x-wonderland-2; jessie-andrews-x-wonderland-3; jessie-andrews-x-wonderland-4
JONATHAN BAILEY x Loewe Pre-met Gala,pamela-anderson-jacquemus,67e0f5d52a78aeb2279ecc81,67da44024929a3dd38d282e1,67e62736e61ee8b3c5195238,Fri Mar 28 2025 04:36:06 GMT+0000 (Coordinated Universal Time),Fri Mar 28 2025 04:36:06 GMT+0000 (Coordinated Universal Time),Fri Mar 28 2025 04:36:06 GMT+0000 (Coordinated Universal Time),https://cdn.prod.website-files.com/67da44024929a3dd38d282e7/67e38b2d3db0c2da09044ce1_asset-29.jpeg,,,jonathan-bailey-x-loewe-pre-met-gala-1; jonathan-bailey-x-loewe-pre-met-gala-2; jonathan-bailey-x-loewe-pre-met-gala-3
LOREN LENOX for Page Magazine - Feature,loren-lenox-for-page-magazine-feature-b59bf,67e0f5d52a78aeb2279ecc81,67da44024929a3dd38d282e1,67e627343e65b7ac590a168e,Fri Mar 28 2025 04:36:04 GMT+0000 (Coordinated Universal Time),Fri Mar 28 2025 04:36:04 GMT+0000 (Coordinated Universal Time),Fri Mar 28 2025 04:36:04 GMT+0000 (Coordinated Universal Time),https://cdn.prod.website-files.com/67da44024929a3dd38d282e7/67e38b22ab92e445c8259b31_asset-8.jpeg,,,loren-lenox-for-page-magazine-feature-1; loren-lenox-for-page-magazine-feature-2; loren-lenox-for-page-magazine-feature-3; loren-lenox-for-page-magazine-feature-4; loren-lenox-for-page-magazine-feature-5
LUCKY BLUE SMITH x Prada,holly-lim-mirror-palais,67e0f5d52a78aeb2279ecc81,67da44024929a3dd38d282e1,67e62782346477f4e69562dd,Fri Mar 28 2025 04:37:22 GMT+0000 (Coordinated Universal Time),Fri Mar 28 2025 04:37:22 GMT+0000 (Coordinated Universal Time),Fri Mar 28 2025 04:37:22 GMT+0000 (Coordinated Universal Time),https://cdn.prod.website-files.com/67da44024929a3dd38d282e7/67e38b22ab92e445c8259b31_asset-8.jpeg,Paris,,lucky-blue-smith-x-prada-1; lucky-blue-smith-x-prada-2; lucky-blue-smith-x-prada-3; lucky-blue-smith-x-prada-4; lucky-blue-smith-x-prada-5
"LUCKY BLUE SMITH, NARA BLUE SMITH",holly-lim-en-route,67e0f5d52a78aeb2279ecc81,67da44024929a3dd38d282e1,67e627b37dc2c164381d0020,Fri Mar 28 2025 04:38:11 GMT+0000 (Coordinated Universal Time),Fri Mar 28 2025 04:38:11 GMT+0000 (Coordinated Universal Time),Fri Mar 28 2025 04:38:11 GMT+0000 (Coordinated Universal Time),https://cdn.prod.website-files.com/67da44024929a3dd38d282e7/67e38b5f9c6f231ea0b71d80_asset-9.png, Paris,,lucky-blue-smith-nara-blue-smith-1; lucky-blue-smith-nara-blue-smith-2; lucky-blue-smith-nara-blue-smith-3; lucky-blue-smith-nara-blue-smith-4; lucky-blue-smith-nara-blue-smith-5
LUCY RAE MCFADIN x Coach,lucky-blue-smith-nara-blue-smith-paris,67e0f5d52a78aeb2279ecc81,67da44024929a3dd38d282e1,67e627b1346db6f95b2eff48,Fri Mar 28 2025 04:38:09 GMT+0000 (Coordinated Universal Time),Fri Mar 28 2025 04:38:09 GMT+0000 (Coordinated Universal Time),Fri Mar 28 2025 04:38:09 GMT+0000 (Coordinated Universal Time),https://cdn.prod.website-files.com/67da44024929a3dd38d282e7/67e38b28af02bfe3605238d8_asset-7.jpeg,,,lucy-rae-mcfadin-x-coach-1; lucy-rae-mcfadin-x-coach-2; lucy-rae-mcfadin-x-coach-3; lucy-rae-mcfadin-x-coach-4; lucy-rae-mcfadin-x-coach-5; lucy-rae-mcfadin-x-coach-6; lucy-rae-mcfadin-x-coach-7
NARA SMITH x Calvin Klein,pamela-anderson-dior,67e0f5d52a78aeb2279ecc81,67da44024929a3dd38d282e1,67e62778582f8307d75cbf76,Fri Mar 28 2025 04:37:12 GMT+0000 (Coordinated Universal Time),Fri Mar 28 2025 04:37:12 GMT+0000 (Coordinated Universal Time),Fri Mar 28 2025 04:37:12 GMT+0000 (Coordinated Universal Time),https://cdn.prod.website-files.com/67da44024929a3dd38d282e7/67e38b636dcabb8ddbaa0d67_asset-31.png,,,nara-smith-x-calvin-klein-1; nara-smith-x-calvin-klein-2; nara-smith-x-calvin-klein-3
PAMELA ANDERSON x Dior,pheobe-tonkin-nyc-2024,67e0f5d52a78aeb2279ecc81,67da44024929a3dd38d282e1,67e62757d25a09908289642f,Fri Mar 28 2025 04:36:39 GMT+0000 (Coordinated Universal Time),Fri Mar 28 2025 04:36:39 GMT+0000 (Coordinated Universal Time),Fri Mar 28 2025 04:36:39 GMT+0000 (Coordinated Universal Time),https://cdn.prod.website-files.com/67da44024929a3dd38d282e7/67e38b568e9a639c331129ef_asset-36.png,,,pamela-anderson-x-dior-1; pamela-anderson-x-dior-2; pamela-anderson-x-dior-3; pamela-anderson-x-dior-4
PAMELA ANDERSON x Jacquemus,pamela-anderson-pandora,67e0f5d52a78aeb2279ecc81,67da44024929a3dd38d282e1,67e62793479b0d924ccce9a4,Fri Mar 28 2025 04:37:39 GMT+0000 (Coordinated Universal Time),Fri Mar 28 2025 04:37:39 GMT+0000 (Coordinated Universal Time),Fri Mar 28 2025 04:37:39 GMT+0000 (Coordinated Universal Time),https://cdn.prod.website-files.com/67da44024929a3dd38d282e7/67e38b38b054d5916564f29c_asset-33.jpeg,,,pamela-anderson-x-jacquemus-1; pamela-anderson-x-jacquemus-2; pamela-anderson-x-jacquemus-3
PAMELA ANDERSON x Pandora,sami-miro-ebay,67e0f5d52a78aeb2279ecc81,67da44024929a3dd38d282e1,67e62777454a75e2b7e0ef83,Fri Mar 28 2025 04:37:11 GMT+0000 (Coordinated Universal Time),Fri Mar 28 2025 04:37:11 GMT+0000 (Coordinated Universal Time),Fri Mar 28 2025 04:37:11 GMT+0000 (Coordinated Universal Time),https://cdn.prod.website-files.com/67da44024929a3dd38d282e7/67e38b3fa9f43d191c9d9e15_asset-39.png,,,pamela-anderson-x-pandora-1; pamela-anderson-x-pandora-2; pamela-anderson-x-pandora-3; pamela-anderson-x-pandora-4; pamela-anderson-x-pandora-5
PHOEBE TONKIN,sami-miro-hm,67e0f5d52a78aeb2279ecc81,67da44024929a3dd38d282e1,67e6277a346db6f95b2eb8fd,Fri Mar 28 2025 04:37:14 GMT+0000 (Coordinated Universal Time),Fri Mar 28 2025 04:37:14 GMT+0000 (Coordinated Universal Time),Fri Mar 28 2025 04:37:14 GMT+0000 (Coordinated Universal Time),https://cdn.prod.website-files.com/67da44024929a3dd38d282e7/67e38b4c654ded82891a8d7d_asset-40.png,Nyc,2024,phoebe-tonkin-1; phoebe-tonkin-2; phoebe-tonkin-3; phoebe-tonkin-4; phoebe-tonkin-5; phoebe-tonkin-6
SAMI MIRO Vintage,tinx-david-yurman,67e0f5d52a78aeb2279ecc81,67da44024929a3dd38d282e1,67e627bad87c95b370739172,Fri Mar 28 2025 04:38:18 GMT+0000 (Coordinated Universal Time),Fri Mar 28 2025 04:38:18 GMT+0000 (Coordinated Universal Time),Fri Mar 28 2025 04:38:18 GMT+0000 (Coordinated Universal Time),https://cdn.prod.website-files.com/67da44024929a3dd38d282e7/67e38b22ab92e445c8259b31_asset-8.jpeg,,,sami-miro-vintage-1; sami-miro-vintage-2; sami-miro-vintage-3; sami-miro-vintage-4
SAMI MIRO x Ebay,sami-miro-ferragamo,67e0f5d52a78aeb2279ecc81,67da44024929a3dd38d282e1,67e6279bfa89b60c548fe6d7,Fri Mar 28 2025 04:37:47 GMT+0000 (Coordinated Universal Time),Fri Mar 28 2025 04:37:47 GMT+0000 (Coordinated Universal Time),Fri Mar 28 2025 04:37:47 GMT+0000 (Coordinated Universal Time),https://cdn.prod.website-files.com/67da44024929a3dd38d282e7/67e38b2a63d5bc34f575ca82_asset-1.png,,,sami-miro-x-ebay-1; sami-miro-x-ebay-2; sami-miro-x-ebay-3; sami-miro-x-ebay-4; sami-miro-x-ebay-5; sami-miro-x-ebay-6; sami-miro-x-ebay-7
